<?xml version="1.0" encoding="UTF-8"?>
<xs:schema xmlns:xs="http://www.w3.org/2001/XMLSchema"
           xmlns="http://www.example.com/investment"
           targetNamespace="http://www.example.com/investment"
           elementFormDefault="qualified">

    <!-- Define the types -->
    <xs:element name="InvestmentManagement">
        <xs:complexType>
            <xs:sequence>
                <xs:element name="Investor">
                    <xs:complexType>
                        <xs:sequence>
                            <xs:element name="ID" type="xs:string"/>
                            <xs:element name="Name" type="xs:string"/>
                            <xs:element name="DateOfBirth" type="xs:date"/>
                            <xs:element name="Email" type="xs:string"/>
                            <xs:element name="PhoneNumber">
                                <xs:complexType>
                                    <xs:simpleContent>
                                        <xs:extension base="xs:string">
                                            <xs:attribute name="type" type="xs:string" use="required"/>
                                        </xs:extension>
                                    </xs:simpleContent>
                                </xs:complexType>
                            </xs:element>
                            <xs:element name="Address">
                                <xs:complexType>
                                    <xs:sequence>
                                        <xs:element name="Street" type="xs:string"/>
                                        <xs:element name="City" type="xs:string"/>
                                        <xs:element name="State" type="xs:string"/>
                                        <xs:element name="ZipCode" type="xs:string"/>
                                        <xs:element name="Country" type="xs:string"/>
                                    </xs:sequence>
                                </xs:complexType>
                            </xs:element>
                            <xs:element name="Investment" maxOccurs="unbounded">
                                <xs:complexType>
                                    <xs:sequence>
                                        <xs:element name="Type" type="xs:string"/>
                                        <xs:element name="Amount">
                                            <xs:complexType>
                                                <xs:simpleContent>
                                                    <xs:extension base="xs:decimal">
                                                        <xs:attribute name="currency" type="xs:string" use="required"/>
                                                    </xs:extension>
                                                </xs:simpleContent>
                                            </xs:complexType>
                                        </xs:element>
                                        <xs:element name="Date" type="xs:date"/>
                                        <xs:element name="InvestmentPerformance">
                                            <xs:complexType>
                                                <xs:sequence>
                                                    <xs:element name="PerformanceDate" type="xs:date"/>
                                                    <xs:element name="Value">
                                                        <xs:complexType>
                                                            <xs:simpleContent>
                                                                <xs:extension base="xs:decimal">
                                                                    <xs:attribute name="currency" type="xs:string" use="required"/>
                                                                </xs:extension>
                                                            </xs:simpleContent>
                                                        </xs:complexType>
                                                    </xs:element>
                                                    <xs:element name="Change" type="xs:string"/>
                                                </xs:sequence>
                                            </xs:complexType>
                                        </xs:element>
                                    </xs:sequence>
                                </xs:complexType>
                            </xs:element>
                            <xs:element name="TotalValue">
                                <xs:complexType>
                                    <xs:simpleContent>
                                        <xs:extension base="xs:decimal">
                                            <xs:attribute name="currency" type="xs:string" use="required"/>
                                        </xs:extension>
                                    </xs:simpleContent>
                                </xs:complexType>
                            </xs:element>
                        </xs:sequence>
                    </xs:complexType>
                </xs:element>
            </xs:sequence>
        </xs:complexType>
    </xs:element>

</xs:schema>
